Logo,Title,Location,Company,Description,ApplyLink,Job_type
 ,Sales Coordinator,"San Diego, CA",Miltons Craft Bakers,"Based in Carlsbad, CA, Milton's Craft Bakers (""Milton's"") sets the benchmark for delicious, trustworthy craft foods. Milton's is a flavor forward, category disrupting brand known for its breads ...",https://www.ziprecruiter.com/jobs/john-stevenson-plumbing-heating-air-caae7715/customer-service-representative-6ba9649f?lvk=iuiBA0pvz1x3IXmcSvOY1w.--Lmi8CgGtZ,Full-Time
 ,Customer Service Representative,"Carlsbad, CA",John Stevenson Plumbing Heating & Air,Job Description : The CSR position is one of the most vital components of the business. As the CSR you will be the first voice heard to existing and potentialcustomers. You will be responsible for ...,https://www.ziprecruiter.com/ojob/6337ea9a98bda72204835ee5a5f7cdd6?lvk=8P02lNff2xX8XztBQZpZPQ.--LnnzxuCFk,Full-Time
 ,Customer Service Representative,"Carlsbad, CA",FASTSIGNS International,Do your friends and co-workers refer to you as a people person? Have friends or people told you or suggested you go into sales? Do you enjoy working with people? Do you enjoy helping people solve ...,https://www.ziprecruiter.com/jobs/targetcw-69111d9e/shipping-associate-4f7b2e8e?lvk=weDpu1JdDAldTGdW4Qqu4w.--LnqCPTcAN,Full-Time
https://www.ziprecruiter.com/svc/fotomat/public-ziprecruiter/uploads/cfa6f810.jpeg=s64x64,Shipping Associate,"Carlsbad, CA",TargetCW,"Shipping Associate San Diego, 92126 Full Time Mon- Fri $14/hr + Benefits 6:30am-3:00pm ARE YOU LOOKING FOR IMMEDIATE WORK THAT REQUIRES LITTLE EXPERIENCE? IF YOU HAVE 2+ YEARS OF WAREHOUSE/SHIPPING ...",https://www.ziprecruiter.com/jobs/cybercoders-696202fb/project-manager-bd35bf48?lvk=hyfQ6TheK34vML3n48dmGg.--LoCSxpo-g,Full-Time
 ,Project Manager,"Vista, CA",Cybercoders,Project Manager We have an urgent opening for an experienced Project Manager to work on a tenant improvement projects in SD Top Reasons to Work with Us We are big on culture and want to make sure you ...,https://kelly.secure.force.com/CandidateExperience/CandExpJobDetails?id=a7V2E0000005EYP&rx_source=ziprecruiter&utm_source=ziprecruiter&utm_medium=cpc&utm_campaign=paid_b2c_always-on&utm_content=ziprecruiter_always-on,Full-Time
 ,PJ10 - Project Manager,"San Marcos, CA",Kelly Services,"Title: Project Manager, Productivity & Sustainability Location: Carlsbad, CA Summary: Project Manage Productivity & Sustainability programs. Essential Functions: Assists in the definition and scope ...",https://www.ziprecruiter.com/jobs/carlsbad-bicycle-company-afc2dec1/admin-secretary-950cc044?lvk=uY0hA-3yT-uscSJxFy4DIQ.--LnfryWvkw,Part-Time
 ,Admin/Secretary,"Carlsbad, CA",Carlsbad Bicycle Company,DUTIES: Data entry into excel workbooks Process payments from customers and prepare bank deposits Update sales orders. CORE COMPETENCIES Accurate and honest with good work ethic Maintains ...,https://www.ziprecruiter.com/jobs/e-force-5184a75a/sporting-goods-insidesales-representative-375da622?lvk=wArsE5nkg0r7P5fXpge8Tg.--LnrP5lTAs,Full-Time
 ,Sporting Goods InsideSales Representative,"Oceanside, CA",E-Force,Sporting Goods InsideSales Representative North San Diego County Sporting Goods manufacturer company seeks individuals for in-house sales calls and activities to existing resell accounts and ...,https://www.ziprecruiter.com/jobs/penske-cde43d24/truck-driver-hiker-vehicle-transporter-cdl-part-time-b8e7151f?lvk=urq2yX036JN0XS4EUZ7fwA.--LnO1EGrSo,Part-Time
